Message_ID,Sender,Recipient,Subject,Message,Timestamp
1,Alice,Bob,Meeting Tomorrow,"Hey Bob, let's meet at 2 PM to discuss the project.",2024-01-10 09:00:00
2,Bob,Alice,Re: Meeting Tomorrow,Sounds good! I’ll be there.,2024-01-10 09:05:00
3,Charlie,Alice,Project Update,"Hi Alice, here is the latest update on the project.",2024-01-10 09:10:00
4,Dave,Alice,Follow-up,Just following up on our last conversation.,2024-01-10 09:15:00
5,Eva,Bob,Report Submission,Attached is the report for your review.,2024-01-10 09:20:00
